{
  "schema": "FIT_METROLOGY_RECORD_1",
  "record_origin": "NO_PHYSICAL_RESULT",
  "run_id": null,
  "rig_revision": null,
  "fixture_revision": null,
  "source_main": null,
  "surface_witness_id": null,
  "source_identities": {},
  "coupon_identities": {},
  "calibration_receipt": null,
  "processing_receipt": null,
  "criteria_receipt": null,
  "mode": "ACQUISITION",
  "repeat_index": null,
  "commanded_initial_pose": null,
  "measured_initial_pose": null,
  "final_pose": null,
  "disengagement": {
    "time_s": null,
    "constrained_dofs": null,
    "clamps_clear": null,
    "jaws_clear": null,
    "guard_contact": null
  },
  "trajectory": null,
  "trajectory_max_gap_s": null,
  "contact_sequence": null,
  "support_observations": null,
  "force_channels": null,
  "sparse_residuals": null,
  "field_residuals": null,
  "required_field_cells": null,
  "full_field_file": null,
  "protected_surrogate_contacts": null,
  "support_loss": null,
  "multiple_terminal_states": null,
  "calibration_error_mm": null,
  "fixture_deflection_mm": null,
  "environment": {},
  "missing_data_reasons": {},
  "physical_result": null
}
